{
  "gap": "G-enforcement-elsewhere-1664860ad0",
  "agent": "gap-resolver",
  "status": "answered",
  "answer": "Yes: the reject handler is the shared helper srv/handlers/transition.js built with transition('S', 'R'), which reads the order's status_code and rejects with 409 unless it equals 'S', so the server enforces \"status_code = S\" for Orders.reject. The parser missed it because the handler is a require()'d factory result (handler module -> transition helper); this require-a-factory pattern recurs for all three actions and is a candidate for a deterministic rule.",
  "findings": [
    {
      "title": "Orders.reject enforces status_code = S in the transition helper",
      "statement": "srv/order-service.js registers the reject handler from srv/handlers/reject.js, which exports transition('S', 'R'). The transition step selects the order's status_code and calls req.reject(409) when it is not 'S', then updates it to 'R'. The UI's Core.OperationAvailable rule (status_code = S) is therefore backed by a server check in the Node handler, not only hidden in the UI. Only the OrderService action path is covered: AdminService exposes sales.Orders without this handler, so an Admin could still write status_code directly.",
      "confidence": "high",
      "severity": {
        "level": "good"
      },
      "layer": "handler",
      "subjects": [
        "uirule:OrderService.Orders.reject:available"
      ],
      "evidence": [
        {
          "file": "srv/order-service.js",
          "line": 8,
          "quote": "this.on('reject', Orders, require('./handlers/reject'))"
        },
        {
          "file": "srv/handlers/reject.js",
          "line": 1,
          "quote": "require('./transition')('S', 'R')"
        },
        {
          "file": "srv/handlers/transition.js",
          "line": 3,
          "quote": "const order = await SELECT.one.from(Orders, ID).columns('status_code')"
        },
        {
          "file": "srv/handlers/transition.js",
          "line": 5,
          "quote": "if (order.status_code !== from) return req.reject(409, `Only orders in status ${from} can do this`)"
        },
        {
          "file": "srv/handlers/transition.js",
          "line": 9,
          "quote": "module.exports = (from, to) => function (req) { return step(this.entities.Orders, req, from, to) }"
        }
      ],
      "test": "POST /orders/Orders(ID=aaaaaaaa-0000-0000-0000-000000000001,IsActiveEntity=true)/OrderService.reject as carol (order not in status S) should return 409 \"Only orders in status S can do this\"."
    }
  ]
}
